f421d800 654272994 S Bo:003:02 -115 31 = 55534243 380f0000 00000000 00000600 00000000 00000000 00000000 000000
f421d800 654273179 C Bo:003:02 0 31 >
f421d800 654273519 S Bi:003:03 -115 13 <
f421d800 654273675 C Bi:003:03 0 13 = 55534253 380f0000 00000000 01
f421d800 654273745 S Bo:003:02 -115 31 = 55534243 390f0000 12000000 80000603 00000012 00000000 00000000 000000
f421d800 654273799 C Bo:003:02 0 31 >
e91ede00 654273860 S Bi:003:03 -115 18 <
e91ede00 654274427 C Bi:003:03 0 18 = 70000200 0000000a 00000000 3a000000 0000
f421d800 654274457 S Bi:003:03 -115 13 <
f421d800 654274549 C Bi:003:03 0 13 = 55534253 390f0000 00000000 00
f421d800 656320986 S Bo:003:02 -115 31 = 55534243 3a0f0000 00000000 00000600 00000000 00000000 00000000 000000
f421d800 656321109 C Bo:003:02 0 31 >
f421d800 656321659 S Bi:003:03 -115 13 <
f421d800 656321707 C Bi:003:03 0 13 = 55534253 3a0f0000 00000000 01
f421d800 656321989 S Bo:003:02 -115 31 = 55534243 3b0f0000 12000000 80000603 00000012 00000000 00000000 000000
f421d800 656322084 C Bo:003:02 0 31 >
e91ede00 656322119 S Bi:003:03 -115 18 <
e91ede00 656322833 C Bi:003:03 0 18 = 70000200 0000000a 00000000 3a000000 0000
f421d800 656322891 S Bi:003:03 -115 13 <
f421d800 656322957 C Bi:003:03 0 13 = 55534253 3b0f0000 00000000 00
f421d800 658368972 S Bo:003:02 -115 31 = 55534243 3c0f0000 00000000 00000600 00000000 00000000 00000000 000000
f421d800 658369119 C Bo:003:02 0 31 >
f421d800 658369633 S Bi:003:03 -115 13 <
f421d800 658369741 C Bi:003:03 0 13 = 55534253 3c0f0000 00000000 01
f421d800 658369879 S Bo:003:02 -115 31 = 55534243 3d0f0000 12000000 80000603 00000012 00000000 00000000 000000
f421d800 658369991 C Bo:003:02 0 31 >
e91edf00 658370128 S Bi:003:03 -115 18 <
e91edf00 658370741 C Bi:003:03 0 18 = 70000200 0000000a 00000000 3a000000 0000
f421d800 658370769 S Bi:003:03 -115 13 <
f421d800 658370867 C Bi:003:03 0 13 = 55534253 3d0f0000 00000000 00
f421d800 660416999 S Bo:003:02 -115 31 = 55534243 3e0f0000 00000000 00000600 00000000 00000000 00000000 000000
f421d800 660417153 C Bo:003:02 0 31 >
f421d800 660417678 S Bi:003:03 -115 13 <
f421d800 660417774 C Bi:003:03 0 13 = 55534253 3e0f0000 00000000 01
f421d800 660417923 S Bo:003:02 -115 31 = 55534243 3f0f0000 12000000 80000603 00000012 00000000 00000000 000000
f421d800 660418025 C Bo:003:02 0 31 >
e91edf00 660418051 S Bi:003:03 -115 18 <
e91edf00 660418774 C Bi:003:03 0 18 = 70000200 0000000a 00000000 3a000000 0000
f421d800 660418811 S Bi:003:03 -115 13 <
f421d800 660418898 C Bi:003:03 0 13 = 55534253 3f0f0000 00000000 00
f421d800 662464981 S Bo:003:02 -115 31 = 55534243 400f0000 00000000 00000600 00000000 00000000 00000000 000000
f421d800 662465104 C Bo:003:02 0 31 >
f421d800 662465655 S Bi:003:03 -115 13 <
f421d800 662466057 C Bi:003:03 0 13 = 55534253 400f0000 00000000 01
f421d800 662466097 S Bo:003:02 -115 31 = 55534243 410f0000 12000000 80000603 00000012 00000000 00000000 000000
f421d800 662466182 C Bo:003:02 0 31 >
e91edf00 662466208 S Bi:003:03 -115 18 <
e91edf00 662467564 C Bi:003:03 0 18 = 70000200 0000000a 00000000 3a000000 0000
f421d800 662467609 S Bi:003:03 -115 13 <
f421d800 662467681 C Bi:003:03 0 13 = 55534253 410f0000 00000000 00
f421d800 664512989 S Bo:003:02 -115 31 = 55534243 420f0000 00000000 00000600 00000000 00000000 00000000 000000
f421d800 664513112 C Bo:003:02 0 31 >
f421d800 664513663 S Bi:003:03 -115 13 <
f421d800 664513714 C Bi:003:03 0 13 = 55534253 420f0000 00000000 01
f421d800 664513904 S Bo:003:02 -115 31 = 55534243 430f0000 12000000 80000603 00000012 00000000 00000000 000000
f421d800 664513965 C Bo:003:02 0 31 >
e91edf00 664514023 S Bi:003:03 -115 18 <
e91edf00 664514340 C Bi:003:03 0 18 = 70000200 0000000a 00000000 3a000000 0000
f421d800 664514389 S Bi:003:03 -115 13 <
f421d800 664514464 C Bi:003:03 0 13 = 55534253 430f0000 00000000 00
f421d800 666560990 S Bo:003:02 -115 31 = 55534243 440f0000 00000000 00000600 00000000 00000000 00000000 000000
f421d800 666561127 C Bo:003:02 0 31 >
f421d800 666561660 S Bi:003:03 -115 13 <
f421d800 666561748 C Bi:003:03 0 13 = 55534253 440f0000 00000000 01
f421d800 666561898 S Bo:003:02 -115 31 = 55534243 450f0000 12000000 80000603 00000012 00000000 00000000 000000
f421d800 666561998 C Bo:003:02 0 31 >
e91edf00 666562027 S Bi:003:03 -115 18 <
e91edf00 666562373 C Bi:003:03 0 18 = 70000200 0000000a 00000000 3a000000 0000
f421d800 666562404 S Bi:003:03 -115 13 <
f421d800 666562497 C Bi:003:03 0 13 = 55534253 450f0000 00000000 00
